"8AA58DPB","journalArticle","1995","Reichley, R. M.; Ritchie, D. J.; Bailey, T. C.","Analysis of various creatinine clearance formulas in predicting gentamicin elimination in patients with low serum creatinine.","Pharmacotherapy","","0277-0008","10.1002/j.1875-9114.1995.tb02873.x","","Predicted gentamicin elimination rate constants (kelS) using creatinine clearance (Clcr) estimates from seven equations were compared with kelS calculated from  steady-state serum gentamicin concentrations in 186 hospitalized patients. In  predicting kel, the equations varied significantly in precision (mean absolute  percentage error), and were particularly imprecise among patients with serum  creatinine values of 71 mumol/L or less. Significant differences in bias (mean  prediction error) were also observed. All equations using serum creatinine as an  element showed improved precision, and most showed reduced bias when a minimum  value of 71 mumol/L was used. The Cockcroft-Gault normalized to 72 kg and the  Hull equations are among the simplest to calculate and, when using a minimum  serum creatinine of 71 mumol/L, had significantly greater precision and less bias  than several of the equations. We recommend one of these two methods for  predicting gentamicin kel in patients with low serum creatinine values.","1995-10","2023-07-10 09:10:22","2023-07-10 09:10:22","","625-630","","5","15","","Pharmacotherapy","","","","","","","","eng","","","","","","","Place: United States PMID: 8570436","","","","Adult; Humans; Male; Female; Middle Aged; Aged; Predictive Value of Tests; Body Weight; Reproducibility of Results; Metabolic Clearance Rate; Infusions, Intravenous; Aged, 80 and over; Hospitalization; Creatinine/*blood; Gentamicins/administration & dosage/blood/*pharmacokinetics","","","","","","","","","","","","","","","","","","","","","","","","","","","","","","","","","","","","","","","","","","","","","","",""
"GPEJIY4D","journalArticle","2010","El-Minshawy, Osama; Saber, Rafet A.; Osman, Ashraf","24-hour creatinine clearance reliability for estimation of glomerular filtration rate in different stages of chronic kidney disease.","Saudi journal of kidney diseases and transplantation : an official publication of the Saudi Center for Organ Transplantation, Saudi Arabia","","1319-2442","","","Glomerular Filtration Rate (GFR) is considered the best overall index of renal function currently used. Measurement of 24 hours urine/plasma creatinine ratio  (UV/P) is usually used for estimation of GFR. However little is known about its  accuracy in different stages of Chronic Kidney Disease (CKD) aim: is to evaluate  performance of UV/P in classification of CKD by comparing it with isotopic GFR  (iGFR). 136 patients with CKD were enrolled in this study 80 (59%) were males, 48  (35%) were diabetics. Mean age 46 +/- 13. Creatinine Clearance (Cr.Cl) estimated  by UV/P and Cockroft-Gault (CG) was done for all patients, iGFR was the reference  value. Accuracy of UV/P was 10%, 31%, 49% within +/- 10%, +/- 30%, +/- 50% error  respectively, r(2) = 0.44. CG gave a better performance even when we restrict our  analysis to diabetics only, the accuracy of CG was 19%, 47%, 72% in +/- 10%, +/-  30% and +/- 50% errors respectively, r(2) = 0.63. Both equations gave poor  classification of CKD. In conclusion, UV/P has poor accuracy in estimation of  GFR, The accuracy worsened as kidney disease becomes more severe. We conclude 24  hours CrCl. is not good substitute for measurement of GFR in patients with CKD.","2010-07","2023-07-10 09:10:22","2023-07-10 09:10:22","","686-693","","4","21","","Saudi J Kidney Dis Transpl","","","","","","","","eng","","","","","","","Place: Saudi Arabia PMID: 20587873","","","","Adult; Humans; Male; Female; Middle Aged; Body Weight; Reproducibility of Results; Metabolic Clearance Rate; Sensitivity and Specificity; Kidney Diseases/blood/*physiopathology; Glomerular Filtration Rate/*physiology; Creatinine/blood/*pharmacokinetics; Diabetic Nephropathies/blood/*physiopathology","","","","","","","","","","","","","","","","","","","","","","","","","","","","","","","","","","","","","","","","","","","","","","",""
"233W6XFG","journalArticle","1992","Lee, Y. H.; Liu, R. S.; Chen, M. T.; Yeh, P. S.; Huang, J. K.; Chang, L. S.","Comparison of effective renal plasma flow (ERPF) and endogenous creatinine clearance (Ccr) in evaluation of the differential kidney function: an in vivo  study.","Zhonghua yi xue za zhi = Chinese medical journal; Free China ed","","0578-1337","","","Eleven patients with obstructive uropathy were inserted with a pigtail catheter either for urinary diversion, endopyelotomy or percutaneous nephrolithotomy.  Differential kidney functions were obtained by single-sample technique with I-131  orthoiodohippurate (OIH) and separate endogenous creatinine clearance (Ccr). Good  linear correlation was noted between effective renal plasma flow (ERPF) and Ccr  (r = 0.84, p less than 0.005), but there was still some discrepancy between these  two examinations, chiefly found in two severely obstructed kidneys. Determination  of ERPF by I-131-OIH single-sample technique is a simple, rapid, inexpensive and  relative accurate test to measure the differential kidney function. But if the  ERPF is at extremely low level, further investigations such as sonography of  kidney and separate endogenous creatinine clearance should be done to avoid  unnecessary nephrectomy.","1992-03","2023-07-10 09:10:22","2023-07-10 09:10:22","","147-152","","3","49","","Zhonghua Yi Xue Za Zhi (Taipei)","","","","","","","","eng","","","","","","","Place: China (Republic : 1949- ) PMID: 1316204","","","","Adolescent; Adult; Humans; Male; Female; Middle Aged; Aged; Metabolic Clearance Rate; Aged, 80 and over; *Kidney Function Tests; *Renal Circulation; Creatinine/*metabolism; Hippurates/metabolism","","","","","","","","","","","","","","","","","","","","","","","","","","","","","","","","","","","","","","","","","","","","","","",""
"EBLWZ2DL","journalArticle","2013","Oshima, Kumi; Kanda, Yoshinobu; Nanya, Yasuhito; Tanaka, Masatsugu; Nakaseko, Chiaki; Yano, Shingo; Fujisawa, Shin; Fujita, Hiroyuki; Yokota, Akira; Takahashi, Satoshi; Kanamori, Heiwa; Okamoto, Shinichiro","Allogeneic hematopoietic stem cell transplantation for patients with mildly reduced renal function as defined based on creatinine clearance before  transplantation.","Annals of hematology","","1432-0584 0939-5555","10.1007/s00277-012-1584-1","","While renal comorbidity is generally defined by the serum creatinine level, the creatinine clearance rate (Ccr) is a more accurate indicator of renal function.  Therefore, we retrospectively assessed how mildly reduced renal function as  defined based on Ccr affects the outcome after allogeneic hematopoietic stem cell  transplantation (HSCT). Patients who underwent allogeneic HSCT at the eight  institutes of the Kanto Study Group for Cell Therapy were included in this study.  Based on the corrected Ccr, patients were classified into group 0 (n = 440,  ≥ 90 mL/min/1.73 m(2)), group 1 (n = 56, 60-89 mL/min/1.73 m(2)), or group 2  (n = 11, 30-59 mL/min/1.73 m(2)). Therefore, 67 patients were considered to have  mild renal impairment, whereas only 2 had a serum creatinine level higher than  1.2 mg/dL. Twenty-eight patients required hemodialysis after HSCT, with 5.5, 5.4,  and 9.1 % in groups 0, 1, and 2, respectively (p = 0.65). The incidence of  non-relapse mortality (NRM) was higher in group 2, although these differences  were not statistically significant probably due to the small sample size (23.7,  28.2, and 47.2 % at 3 years, p = 0.20). In conclusion, NRM may be associated with  mildly reduced renal function before allogeneic HSCT, which cannot be detected by  measurement of the serum creatinine level alone.","2013-01","2023-07-10 09:10:22","2023-07-10 09:10:22","","255-260","","2","92","","Ann Hematol","","","","","","","","eng","","","","","","","Place: Germany PMID: 23053182","","","","Adolescent; Adult; Humans; Male; Female; Middle Aged; Aged; Treatment Outcome; Metabolic Clearance Rate; Young Adult; Renal Dialysis; Retrospective Studies; Comorbidity; Kaplan-Meier Estimate; Transplantation, Homologous; Kidney/*physiopathology; Kidney Transplantation; Creatinine/*blood; *Hematopoietic Stem Cell Transplantation/adverse effects; Anemia, Aplastic/blood/surgery; Calcineurin Inhibitors; Graft vs Host Disease/blood/etiology/prevention & control; Hematologic Neoplasms/blood/surgery; Immunosuppressive Agents/adverse effects/therapeutic use; Renal Insufficiency/blood/*etiology/physiopathology/surgery/therapy; Transplantation Conditioning/adverse effects","","","","","","","","","","","","","","","","","","","","","","","","","","","","","","","","","","","","","","","","","","","","","","",""
"6LLA7KEA","journalArticle","1981","Dionne, R. E.; Bauer, L. A.; Gibson, G. A.; Griffen, W. O. Jr; Blouin, R. A.","Estimating creatinine clearance in morbidity obese patients.","American journal of hospital pharmacy","","0002-9289","","","Estimates of creatinine clearance (Clcr), using five methods, were compared to measured Clcr in morbidity obese patients. Patients whose total body weight (TBW)  was greater than or equal to 195% of their ideal body weight (IBW) and who had  urinary Clcr measured with 24-hour urine collections were studied. The 12 men  weighed an average of 180 kg; the 31 women averaged 138 kg. The methods studied  considered a combination of the following factors: weight, age, sex, and serum  creatinine. One method was a nomogram; TBW could not be used because of  limitations of the nomogram. Both TBW and IBW were used in two methods that  considered weight as a variable. Measured Clcr averaged 105.7 ml/min/1.73 sq m  body surface area. All estimating methods using IBW significantly underestimated  Clcr; all methods using TBW significantly overestimated Clcr. Two methods that  did not include body weight as a variable predicted Clcr more accurately than did  other methods, but there was still a significant difference between estimated and  measured Clcr. None of the Clcr estimation methods is accurate in morbidly obese  patients.","1981-06","2023-07-10 09:10:22","2023-07-10 09:10:22","","841-844","","6","38","","Am J Hosp Pharm","","","","","","","","eng","","","","","","","Place: United States PMID: 7246555","","","","Adult; Humans; Male; Female; Middle Aged; Body Weight; Metabolic Clearance Rate; Obesity/*metabolism; Creatinine/*metabolism","","","","","","","","","","","","","","","","","","","","","","","","","","","","","","","","","","","","","","","","","","","","","","",""
"Z35UAGFG","journalArticle","1976","Marya, R. K.; Maini, B. K.; Bajaj, V. R.; Gupta, R. K.","Plasma creatinine and creatinine clearance studies in normal individuals.","Indian journal of medical sciences","","0019-5359","","","","1976-03","2023-07-10 09:10:22","2023-07-10 09:10:22","","98-101","","3","30","","Indian J Med Sci","","","","","","","","eng","","","","","","","Place: India PMID: 1032497","","","","Adult; Humans; Male; Female; Reference Values; Sex Factors; Metabolic Clearance Rate; Creatinine/*blood","","","","","","","","","","","","","","","","","","","","","","","","","","","","","","","","","","","","","","","","","","","","","","",""
"QHYKZ78Z","journalArticle","1988","Aderka, D.; Tene, M.; Graff, E.; Levo, Y.","Amylase-creatinine clearance ratio. A simple test to predict gentamicin nephrotoxicity.","Archives of internal medicine","","0003-9926","10.1001/archinte.148.5.1093","","The initial target of aminoglycoside nephrotoxicity is the proximal tubule. Yet, no simple test is available to predict such toxicity. Taking advantage of the  fact that amylase is filtered in the glomerulus and reabsorbed by the proximal  tubules, we prospectively examined in 23 patients if changes in renal amylase  creatinine clearance ratio (ACCR) can predict gentamicin nephrotoxicity. Eighteen  of these patients had an initial creatinine clearance (rCcr) above 30 mL/min.  Eleven of them (group A) had an ACCR above 3.5% (control 3% +/- 1.03%) and all  exhibited an average reduction of 32.2% +/- 11.6% in rCcr following one week of  gentamicin therapy. In contrast, only one of seven patients (group B) with an  initial ACCR below 3.5% had a reduction, albeit transient, in rCcr. During  gentamicin therapy, group A patients had a further increase in ACCR which was  proportional to the reduction observed in rCcr (r = -.54). Our preliminary data  suggest that ACCR may prove a simple and possibly a reliable predictor of kidney  function deterioration during gentamicin therapy in patients with rCcr above 30  mL/min: patients with pretherapy ACCR above 3.5% may exhibit a deterioration in  the creatinine clearance during the first week of therapy. For patients with  pretherapy renal failure (rCcr less than 30 mL/min) the creatinine levels (but  not the ACCR) seem to retain their significance in predicting and monitoring  further renal function deterioration during aminoglycoside therapy.","1988-05","2023-07-10 09:10:22","2023-07-10 09:10:22","","1093-1096","","5","148","","Arch Intern Med","","","","","","","","eng","","","","","","","Place: United States PMID: 2452611","","","","Humans; Male; Female; Middle Aged; Aged; Prospective Studies; Metabolic Clearance Rate; Aged, 80 and over; Glomerular Filtration Rate/drug effects; Creatinine/*metabolism; Amylases/*metabolism; Acute Kidney Injury/chemically induced/*diagnosis/metabolism; Gentamicins/*adverse effects; Kidney/drug effects/enzymology/*metabolism","","","","","","","","","","","","","","","","","","","","","","","","","","","","","","","","","","","","","","","","","","","","","","",""
"SS2M7Z3I","journalArticle","1998","Gabrielli, A.; Hammett-Stabler, C.","False elevation of serum creatinine following skin absorption of nitromethane complicates the clinical diagnosis of rhabdomyolysis.","Chest","","0012-3692","10.1378/chest.113.5.1419","","A patient had extensive blunt trauma from a high-speed crash in which nitromethane fuel erupted from the fuel tank and soaked into his protective  multilayer jumpsuit. The clinical diagnosis was complicated because the  absorption of nitromethane fuel through the skin and by inhalation falsely  increased the serum creatinine value when a modified Jaffe reaction was used in  the laboratory. This spurious value was ""unmasked"" by the use of an enzymatic  method to measure the serum creatinine level. A high serum creatinine value  disproportionate to the level of BUN and recent skin exposure to nitromethane  were the clinical indications that suggested the differentiation of massive  rhabdomyolysis from spurious hypercreatinemia. This spurious value was a  confounding factor in the diagnosis of crush syndrome and rhabdomyolysis.","1998-05","2023-07-10 09:10:22","2023-07-10 09:10:22","","1419-1422","","5","113","","Chest","","","","","","","","eng","","","","","","","Place: United States PMID: 9596331","","","","Adult; Humans; Male; False Positive Reactions; Blood Urea Nitrogen; Skin Absorption; Creatinine/*blood; Crush Syndrome/*diagnosis; Methane/*analogs & derivatives/pharmacokinetics; Nitroparaffins/*pharmacokinetics; Rhabdomyolysis/*diagnosis; Wounds, Nonpenetrating/complications","","","","","","","","","","","","","","","","","","","","","","","","","","","","","","","","","","","","","","","","","","","","","","",""
"YM6XMYVY","journalArticle","1987","Blythe, W. B.","How to get help from the creatinine clearance and the plasma creatinine concentration.","North Carolina medical journal","","0029-2559","","","","1987-11","2023-07-10 09:10:22","2023-07-10 09:10:22","","579-580","","11","48","","N C Med J","","","","","","","","eng","","","","","","","Place: United States PMID: 3480426","","","","Humans; Metabolic Clearance Rate; *Kidney Function Tests; Glomerular Filtration Rate; Inulin; Creatinine/blood/*metabolism","","","","","","","","","","","","","","","","","","","","","","","","","","","","","","","","","","","","","","","","","","","","","","",""
"N32VBW8R","journalArticle","1992","Smith, B. L.; Sarnoski, T. P.; Dennis, S.; Luke, D. R.","Failure of predicted creatinine clearance equations in HIV-seropositive patients.","International journal of clinical pharmacology, therapy, and toxicology","","0174-4879","","","The Cockcroft and Gault (CG) [1976] method of predicted creatinine clearances (CCR) accurately predicts measured 24-hour CCR values in healthy volunteers. The  present study compared the relationship between measured and predicted CCR  through 5 methods: CG, J1 [Jelliffe 1971], J2 [Jelliffe 1973], M [Mawer et al.  1972], and H [Hull et al. 1981], in 42 HIV-seropositive patients: 21 ARC/21 AIDS,  35M/7F, 26 homosexual/16 intravenous drug users, age: 37 +/- 7 years, actual body  weight: 74 +/- 14 kg, CD4: 0.286 +/- 0.185 x 10(9) cells per liter (mean +/- SD).  Measured CCR values poorly correlated with serum creatinine levels (r = -0.35; p  < 0.01). The average measured CCR was 106 +/- 29 ml/min compared with 94 +/- 21  (CG; r = 0.49), 78 +/- 13 (J1; r = 0.41), 77 +/- 14 (J2; r = 0.44), 97 +/- 21 (M;  r = 0.51) and 95 +/- 17 ml/min (H; r = 0.32). Standardization to body surface  area or lean body weight or stratification by patient factors (gender, disease  stage, risk factors, drug treatment) did not improve correlations. However,  patients with normal microalbumin excretion rates had more predictable CCR values  compared with those who had excess excretion, suggesting the influence of  HIV-associated nephropathy on CCR estimation. Since all predicted CCR equations  consistently underestimated actual values, these equations should be used with  caution in estimating measured CCR in HIV-seropositive patients.","1992-10","2023-07-10 09:10:22","2023-07-10 09:10:22","","394-399","","10","30","","Int J Clin Pharmacol Ther Toxicol","","","","","","","","eng","","","","","","","Place: Germany PMID: 1446956","","","","Adolescent; Adult; Humans; Male; Female; Middle Aged; Predictive Value of Tests; Metabolic Clearance Rate; Child; Mathematics; Creatinine/*pharmacokinetics; HIV Infections/metabolism; HIV Seropositivity/*metabolism","","","","","","","","","","","","","","","","","","","","","","","","","","","","","","","","","","","","","","","","","","","","","","",""
"U3HS756C","journalArticle","1953","MANDEL, E. E.; JONES, F. L.; WILLIS, M. J.; CARGILL, W. H.","Renal excretion of creatinine and inulin in man.","The Journal of laboratory and clinical medicine","","0022-2143","","","","1953-10","2023-07-10 09:10:22","2023-07-10 09:10:22","","621-637","","4","42","","J Lab Clin Med","","","","","","","","eng","","","","","","","Place: United States PMID: 13096900","","","","Kidney/*physiology; *Inulin; Creatinine/*metabolism; *KIDNEYS/physiology; *Renal Elimination; *INULIN; *CREATININE/metabolism; *Biochemical Phenomena","","","","","","","","","","","","","","","","","","","","","","","","","","","","","","","","","","","","","","","","","","","","","","",""
"AURMCAKB","journalArticle","2004","Nyman, Ulf; Hietala, Sven-Ola; Hellström, Mikael; Aspelin, Peter; Björkdahl, Peter; Albrechtsson, Ulf; Magnusson, Anders; Måre, Klas; Törnquist, Carl; Ringertz, Hans; Sterner, Gunnar; Westberg, Gunnar; Berne, Christian","[Iodinated contrast media and nephropathy. Estimated creatinine clearance for better assessment of renal function and dosage].","Ugeskrift for laeger","","0041-5782","","","","2004-06-21","2023-07-10 09:10:22","2023-07-10 09:10:22","","2566-2572","","26-31","166","","Ugeskr Laeger","","","","","","","","dan","","","","","","","Place: Denmark PMID: 15285166","","","","Humans; Male; Female; Reference Values; Risk Factors; Injections, Intravenous; Practice Guidelines as Topic; Osmolar Concentration; Tomography, X-Ray Computed; Kidney Function Tests; Angiography; Kidney Diseases/*chemically induced; Creatinine/blood/*metabolism; Contrast Media/administration & dosage/*adverse effects/pharmacokinetics; Iodine/*adverse effects/pharmacokinetics","","","","","","","","","","","","","","","","","","","","","","","","","","","","","","","","","","","","","","","","","","","","","","",""
"FSUA5WJJ","journalArticle","1966","Gibaldi, M.; Kanig, J. L.","The effect of body position and pH on the gastrointestinal absorption of salicylate and creatinine in man.","Archives internationales de pharmacodynamie et de therapie","","0003-9780","","","","1966-06","2023-07-10 09:10:22","2023-07-10 09:10:22","","343-358","","2","161","","Arch Int Pharmacodyn Ther","","","","","","","","eng","","","","","","","Place: Belgium PMID: 5926876","","","","Humans; *Posture; *Intestinal Absorption; Creatine/*metabolism; *Hydrogen-Ion Concentration; Salicylates/*metabolism/urine; Stomach/*physiology","","","","","","","","","","","","","","","","","","","","","","","","","","","","","","","","","","","","","","","","","","","","","","",""
"BXT6BVQB","journalArticle","2013","Haque, M. F.; Iqbal, M. M.; Ahmed, Z.; Sultan, T.; Rahman, M.; Quddus, S.; Rahman, M. Q.; Ahmed, N. N.","A comparison of GFR by modified gates method with measured creatinine clearance rate (CCR) & MDRD formula based estimation in type 2 diabetic subjects with  nephropathy.","Mymensingh medical journal : MMJ","","1022-4742","","","Accurate estimation of the glomerular filtration rate (GFR) is essential for the evaluation of patient with chronic kidney disease (CKD). The present study was a  comparison between modified gates GFR with laboratory measured CCR & MDRD formula  based estimated GFR method. Pre-diagnosed 180 diabetic nephropathy patients were  selected. All the time of evaluation the blood glucose of the patients were  controlled and serum creatinine was stable. Then CCR was done and GFR was  estimated by Modified Gates method & MDRD method. All the patients were  categorized in 5 stages of CKD. They were matched for age, BMI, blood pressure,  duration of diabetes, the blood sugar and HbA1C levels. The Gates GFR in stage-2  (70±13) & stage-3 (48±12) was closer with MDRD in stage-2 (77±8) and stage 3  (43±7). The CCR is closer in stage-1 (110±52) & stage-4 (30±10) with MDRD in  stage-1 (112±13) and stage-4 (21±4). Association study showed MDRD GFR had  highest correlation with Gates GFR (r=0.86; p<0.05). The estimation of glomerular  filtration rate (GFR) in different methods varied significantly between each  other at different stages of chronic kidney disease (CKD) in type 2 diabetic  nephropathy subjects.","2013-10","2023-07-10 09:10:22","2023-07-10 09:10:22","","655-660","","4","22","","Mymensingh Med J","","","","","","","","eng","","","","","","","Place: Bangladesh PMID: 24292292","","","","Humans; Male; Female; Middle Aged; Aged; Metabolic Clearance Rate; Diabetes Mellitus, Type 2/*physiopathology; *Glomerular Filtration Rate; Diabetic Nephropathies/*physiopathology; Renal Insufficiency, Chronic/*physiopathology; Creatinine/*metabolism","","","","","","","","","","","","","","","","","","","","","","","","","","","","","","","","","","","","","","","","","","","","","","",""
"TKMR7KA7","journalArticle","1988","Echizen, H.; Ishizaki, T.","Superiority of disease-specific over conventional formula in predicting creatinine clearance from serum creatinine in patients with liver cirrhosis.","Therapeutic drug monitoring","","0163-4356","10.1097/00007691-198804000-00001","","To determine if liver cirrhosis may influence the accuracy of formulas estimating creatinine clearance (Clcr) from serum creatinine, we compared the measured and  estimated Clcr in 95 male (group A) and 47 female cirrhotic patients (group B).  The Clcr values of group A and B patients were estimated with the equations  obtained from 93 male (group C) and 86 female patients (group D) who were free of  liver disease: the mean estimation errors (+/- SD) for the group C and D patients  with the equations obtained from their own population data were 5 +/- 24% and 4  +/- 22%, respectively. However, these equations significantly (p less than 0.01)  overestimated the Clcr of cirrhotic patients: the mean estimation errors for the  group A and B patients were 35 +/- 43% and 14 +/- 27%, respectively. In contrast,  the mean estimation errors for the group A and B patients using cirrhotic  patient-specific equations obtained from their own population data were 5 +/- 33%  and 3 +/- 25%, respectively. The accuracy of these disease-specific formulas was  also confirmed in a prospective manner in 43 male (group E) and 21 female  cirrhotic patients (group F): the mean estimation errors for the group E and F  patients were 2 +/- 32% and -7 +/- 29%, respectively. We conclude that the Clcr  values of cirrhotic patients, particularly male patients, may not be accurately  estimated with equations of formulas deriving from liver disease-free patients,  but should be estimated using their own population data.","1988","2023-07-10 09:10:22","2023-07-10 09:10:22","","369-375","","4","10","","Ther Drug Monit","","","","","","","","eng","","","","","","","Place: United States PMID: 3201521","","","","Humans; Male; Female; Prospective Studies; Predictive Value of Tests; Metabolic Clearance Rate; Mathematics; Liver Cirrhosis/blood/*metabolism; Creatine/*blood","","","","","","","","","","","","","","","","","","","","","","","","","","","","","","","","","","","","","","","","","","","","","","",""
